[
  {
    "card_id": "SEMI_MAT_001",
    "sub_sector": "MATERIALS",
    "variable": "客户验证阶段阶梯(按产品线×客户)",
    "why_it_matters": "材料票收入拐点滞后验证通过 1–4 季度,验证阶段是最前瞻的 E1 信号。三路来源独立汇聚:发行人年报用'送样/验证/取得订单/批量供应'计数(鼎龙 30 款布局→20 款送样→3 款批量),招股书披露四阶段认证,卖方框架把认证周期按下游分档(IC 2–3 年)。",
    "data_source": {
      "availability": "SEMI",
      "primary": "年报'经营情况讨论'与'研发项目进展'表;招股书'业务与技术';投资者关系记录;关键词:送样/验证/小批量/取得订单/批量供应/量产",
      "tushare_api": null,
      "tushare_field": null,
      "manual_required": true
    },
    "judgment_logic": {
      "type": "STAGE_LADDER",
      "positive_if": "近 4 季度任一产品线在阶梯上升阶 ≥1,且'取得订单→批量供应'转化率上行",
      "negative_if": "≥2 季度阶段停滞、退阶,或公司改用'多款/进展顺利'模糊措辞且不再给数",
      "lookback": "4Q",
      "threshold": "v0=文献锚/待B4验证(_unvalidated)",
      "stages": [
        "布局",
        "送样",
        "验证通过",
        "取得订单",
        "批量供应"
      ]
    },
    "evidence_tier": "E1",
    "literature": [
      "鼎龙股份 2025 年报 第三节一(二)1(4) 高端晶圆光刻胶('超 30 款……超 20 款完成客户送样验证……3 款进入稳定批量供应')",
      "厦门恒坤新材料 科创板招股说明书(上会稿)2025-08-22 第六节 客户与供应链壁垒(认证四阶段)https://static.sse.com.cn/stock/disclosure/announcement/c/202508/002050_20250822_EYQT.pdf",
      "方正证券《半导体材料研究框架系列:详解八大芯片材料》2022-01-19 '客户壁垒极高'",
      "太平洋证券《光刻胶国产替代迎来良机》2023-04-17 pp.28-29 认证三阶段"
    ],
    "falsification": "封装材料验证快于制造材料,同一阶梯不可跨制造/封装比较;'通过认证'不等于采购量(晶圆厂常做二供备份);已成熟品类(安集主力抛光液、江丰铝钛靶)阶梯饱和,不再领先;订单金额未披露时'取得订单'不等于放量。",
    "channel_binding": [
      "E1_EVENT",
      "LLM_MUST_CHECK"
    ],
    "status": "REVIEWED",
    "authored_by": "Claude (Track B synthesis from 3 collectors: issuer FY2025 reports ×8 / academic ×29 / sell-side ×28)",
    "reviewed_by": "Junyan",
    "as_of": "20260903",
    "review_notes": "★★★ 三源汇聚,建议第一优先审。当前 E1 层零正向事件识别(F-012),本卡是补齐正向事件的核心。需 WO-A6 正向事件类型清单 + NLP 抽取(SEMI)。阶梯词表建议:布局→送样→验证通过→取得订单→批量供应。 ‖ Junyan 2026-09-03 整体批准(REVIEWED):卡组系统性认可;阈值取文献锚为 v0,标 _unvalidated,以 B4 三周期点回看验证后再翻 VALIDATED。"
  },
  {
    "card_id": "SEMI_MAT_002",
    "sub_sector": "MATERIALS",
    "variable": "分产品毛利率水平与同比变动",
    "why_it_matters": "配方型湿化学品/CMP 与硅片/靶材毛利率结构差异极大,综合毛利率对混业公司无意义;分产品毛利率同比方向与量价拆分结论交叉验证(量增价减→毛利率应降,若反升则为新品结构)。验证期公司常以价换量(华特 2019–20 毛利率 35→26%)。",
    "data_source": {
      "availability": "AUTO",
      "primary": "Tushare fina_mainbz(type='P'):bz_item/bz_sales/bz_cost → 毛利率=(bz_sales−bz_cost)/bz_sales;年报'占营收 10% 以上产品'表核对",
      "tushare_api": "fina_mainbz",
      "tushare_field": "bz_item,bz_sales,bz_cost,bz_profit",
      "manual_required": false
    },
    "judgment_logic": {
      "type": "TREND",
      "positive_if": "半导体材料分部毛利率同比 ≥0 且与同品类同业中位差 ≥0",
      "negative_if": "分部毛利率连续 2 期同比下降,且公司自陈'价格承压/内卷'",
      "lookback": "2Y(4 个半年期)",
      "threshold": "v0=文献锚/待B4验证(_unvalidated)"
    },
    "evidence_tier": "E1",
    "literature": [
      "江丰电子 2025 年报 第三节四(2) 分产品(超高纯靶材 34.24% +2.89pp;精密零部件 14.88% −9.39pp)",
      "鼎龙股份 2025 年报 第三节四(2)(半导体材料及芯片 50.88% +3.74pp)",
      "东海证券《电子特气行业深度报告》2023-07-31 第 4 章 华特气体财务分析(验证期定价折让)",
      "Irwin, D.A. & Klenow, P.J. (1994). Learning-by-Doing Spillovers in the Semiconductor Industry. JPE 102(6):1200-1227(学习曲线单价侵蚀)"
    ],
    "falsification": "分产品口径年度间调整(年报'统计口径调整'勾选)时不可比;公司申请豁免披露重要子公司利润时子公司层毛利率不可得;含受托加工的产品线(沪硅)受加工费影响;bz_cost 缺失时只能用 bz_profit/bz_sales 代理并标 PROXY。",
    "channel_binding": [
      "FUNDAMENTAL_VALUATION",
      "BATTERY_基本面"
    ],
    "status": "REVIEWED",
    "authored_by": "Claude (Track B synthesis from 3 collectors: issuer FY2025 reports ×8 / academic ×29 / sell-side ×28)",
    "reviewed_by": "Junyan",
    "as_of": "20260903",
    "review_notes": "★★★ AUTO。复用 research_data_loader.derive_segment_economics(已实现分部毛利计算,含 PROXY 标记),改造为半导体版。fina_mainbz type='P' 已由 fetch_tushare.py 以 5 年窗口拉取。同业中位需材料票池(WO-A9 sub_sector)。 ‖ Junyan 2026-09-03 整体批准(REVIEWED):卡组系统性认可;阈值取文献锚为 v0,标 _unvalidated,以 B4 三周期点回看验证后再翻 VALIDATED。"
  },
  {
    "card_id": "SEMI_MAT_003",
    "sub_sector": "MATERIALS",
    "variable": "量价拆分:分产品收入增速 − 销量增速 ≈ 隐含 ASP 变动",
    "why_it_matters": "材料票的周期位置由量价组合定义:量升价跌=筑底/产能释放期,量价齐升=上行期,量跌价跌=下行。非标品(光刻胶/特气/抛光液)无公开价格序列,只能从年报产销量表反推。沪硅 2025 自陈'量增价减的分化特征'。",
    "data_source": {
      "availability": "SEMI",
      "primary": "收入端 fina_mainbz(type='P') bz_sales(AUTO);销量端 年报'产销量情况分析表'(深交所:实物销售收入表;上交所:产销量表)需表格解析;价格表述关键词:价格承压/内卷/量增价减/价格中枢",
      "tushare_api": "fina_mainbz",
      "tushare_field": "bz_sales",
      "manual_required": true
    },
    "judgment_logic": {
      "type": "CYCLE_POSITION",
      "positive_if": "隐含 ASP 同比 ≥0 且销量同比 >0(量价齐升)",
      "negative_if": "隐含 ASP 同比 <0 且销量同比 <0(量价齐跌);或公司文字出现'价格承压/内卷'",
      "lookback": "2Y",
      "threshold": "v0=文献锚/待B4验证(_unvalidated)"
    },
    "evidence_tier": "E1",
    "literature": [
      "沪硅产业 2025 年报 第三节二 经营情况讨论('市场呈现量增价减的分化特征''持续面临较大的价格压力')",
      "安集科技 2025 年报 第三节五(2) 产销量情况分析表(抛光液 产 45,691.51 吨/销 42,188.67 吨/库存 6,801.05 吨)",
      "方正证券 2022-01-19 '半导体材料短期看点:涨价';国盛证券《硅片行业深度》2022-04-02 p.19(2016–18 硅片单位面积价格上涨)"
    ],
    "falsification": "产品结构切换(高规格新品放量)时隐含 ASP 上升是混合效应非涨价;计量单位不可比(靶材 枚/套/公斤 混计,鼎龙 支/吨/片 合并)时不能算;单一产品线且无销量披露的公司不适用;受托加工计入销量时需剔除。",
    "channel_binding": [
      "FUNDAMENTAL_VALUATION",
      "LLM_MUST_CHECK"
    ],
    "status": "REVIEWED",
    "authored_by": "Claude (Track B synthesis from 3 collectors: issuer FY2025 reports ×8 / academic ×29 / sell-side ×28)",
    "reviewed_by": "Junyan",
    "as_of": "20260903",
    "review_notes": "★★★ 三源汇聚。销量表解析是 SEMI 的核心工程量(WO-A11 evidence_pack 可扩展做年报表格抽取)。四象限周期位置 = normalized 桥的直接输入(WO-L9 adapter v2 的 units×ASP)。 ‖ Junyan 2026-09-03 整体批准(REVIEWED):卡组系统性认可;阈值取文献锚为 v0,标 _unvalidated,以 B4 三周期点回看验证后再翻 VALIDATED。"
  },
  {
    "card_id": "SEMI_MAT_004",
    "sub_sector": "MATERIALS",
    "variable": "分产品实物库存量同比 − 销量同比(成品积压警戒)",
    "why_it_matters": "年报强制按产品线披露产量/销量/库存量及同比,并对变动 30% 以上作说明。库存量增速显著超过销量增速 = 成品积压或主动备货,公司被迫在'原因说明'里表态,是 E1 级的自陈信号。",
    "data_source": {
      "availability": "SEMI",
      "primary": "年报第三节 产销量情况分析表 + '相关数据同比变动 30% 以上的原因说明'",
      "tushare_api": null,
      "tushare_field": null,
      "manual_required": true
    },
    "judgment_logic": {
      "type": "THRESHOLD",
      "positive_if": "库存量同比 − 销量同比 ≤ 0,或差值为正但公司说明为'为已签订单/新认证产品备货'",
      "negative_if": "库存量同比 − 销量同比 显著为正且说明为'客户需求下降/去库存'",
      "lookback": "1Y",
      "threshold": "v0=文献锚/待B4验证(_unvalidated)"
    },
    "evidence_tier": "E1",
    "literature": [
      "安集科技 2025 年报 第三节五(2)(库存 +68.74% vs 销 +35.91%)",
      "深交所《上市公司自律监管指引》年报格式 主营业务分析 实物销售表要求"
    ],
    "falsification": "多产品线合并计量单位时量信息被抹掉;受托加工计入销量;库存高增若解释为主动战略备货(原料端)方向相反,需与卡 8(存货结构)联动判定。",
    "channel_binding": [
      "FUNDAMENTAL_VALUATION",
      "BATTERY_基本面"
    ],
    "status": "REVIEWED",
    "authored_by": "Claude (Track B synthesis from 3 collectors: issuer FY2025 reports ×8 / academic ×29 / sell-side ×28)",
    "reviewed_by": "Junyan",
    "as_of": "20260903",
    "review_notes": "★ 单源(发行人)但强制披露、口径稳定。与卡 3 共用同一张表的解析,边际成本低。差值阈值待定(文献无锚,建议先用'公司是否被迫作原因说明'的二值)。 ‖ Junyan 2026-09-03 整体批准(REVIEWED):卡组系统性认可;阈值取文献锚为 v0,标 _unvalidated,以 B4 三周期点回看验证后再翻 VALIDATED。"
  },
  {
    "card_id": "SEMI_MAT_005",
    "sub_sector": "MATERIALS",
    "variable": "在建工程→固定资产转固节奏与折旧跳升(增收不增利识别)",
    "why_it_matters": "扩产期在建工程余额高,转固当年折旧跳升;利用率决定是否摊薄。上海新阳 2025 集成电路材料折旧 +101%,自陈'新建产能尚处爬坡阶段,固定成本高'。D&A/营收见顶回落 + 利用率上行 = 拐点前置(国盛跟踪沪硅该比率)。",
    "data_source": {
      "availability": "AUTO",
      "primary": "Tushare balancesheet.cip / fix_assets 两期差分;cashflow.depr_fa_coga_dpba(折旧)/ income.revenue;年报'营业成本构成'表中折旧行核对",
      "tushare_api": "balancesheet,cashflow,income",
      "tushare_field": "balancesheet.cip,balancesheet.fix_assets,cashflow.depr_fa_coga_dpba,income.revenue",
      "manual_required": false
    },
    "judgment_logic": {
      "type": "STAGE_LADDER",
      "positive_if": "在建工程余额回落 + 固定资产增加(转固完成)且 D&A/营收同比开始回落",
      "negative_if": "在建工程持续高位 + D&A/营收上升 + 收入增速 < D&A 增速(增收不增利)",
      "lookback": "3Y",
      "threshold": "v0=文献锚/待B4验证(_unvalidated)",
      "stages": [
        "立项",
        "建设",
        "转固",
        "爬坡",
        "满产"
      ]
    },
    "evidence_tier": "E1",
    "literature": [
      "上海新阳 2025 年报 第三节四(5) 营业成本构成('集成电路材料折旧 33,697,105.49 元 +101.12%……部分在建工程转固后固定成本高')",
      "国盛证券 2022-04-02 图表 48(沪硅产业 折旧及摊销占营收比)",
      "太平洋证券 2023-04-17 pp.30-35 光刻胶产业链公司 设计产能/产能利用率/在建产能 表"
    ],
    "falsification": "轻资产配方型公司(安集制造费用占比 22.82%)折旧敏感度低,本卡权重应降;转固时点可被会计政策延后(在建工程长期挂账)会低估压力;折旧口径含非半导体业务(鼎龙耗材、雅克 LNG)时需拆分;若新产线对应已签长协定制产能则利用率风险小。",
    "channel_binding": [
      "FUNDAMENTAL_VALUATION",
      "BATTERY_基本面"
    ],
    "status": "REVIEWED",
    "authored_by": "Claude (Track B synthesis from 3 collectors: issuer FY2025 reports ×8 / academic ×29 / sell-side ×28)",
    "reviewed_by": "Junyan",
    "as_of": "20260903",
    "review_notes": "★★ AUTO,源已付费零调用(balancesheet/cashflow),WO-X1 扩源后即可算。阶梯:立项→建设→转固→爬坡→满产,前三阶段可 AUTO 判,后两阶段需卡 6。 ‖ Junyan 2026-09-03 整体批准(REVIEWED):卡组系统性认可;阈值取文献锚为 v0,标 _unvalidated,以 B4 三周期点回看验证后再翻 VALIDATED。"
  },
  {
    "card_id": "SEMI_MAT_006",
    "sub_sector": "MATERIALS",
    "variable": "产能利用率与在建产能三元组(设计产能/利用率/在建)",
    "why_it_matters": "利用率低且在建产能大 = 固定成本压力期;接近满产且在建产能落地在即 = 量的释放窗口。深交所化工行业公司(雅克)强制披露产能表;其余散见文字(沪硅'85 万片/月')。",
    "data_source": {
      "availability": "SEMI",
      "primary": "年报'主要产品的产能情况'表(深交所化工指引)或'占营收 10% 以上产品产销情况';募投公告;文字 NER:万片/月、吨/年、产能利用率",
      "tushare_api": null,
      "tushare_field": null,
      "manual_required": true
    },
    "judgment_logic": {
      "type": "THRESHOLD",
      "positive_if": "利用率上行趋势且在建产能/现有产能 比处于合理区间(待定)",
      "negative_if": "利用率 <60%(太平洋表格示例 59.25% 为低位参照,未验证)且在建产能大",
      "lookback": "2Y",
      "threshold": "60%(卖方单例参照,未验证)"
    },
    "evidence_tier": "E1",
    "literature": [
      "沪硅产业 2025 年报 第三节二('上海及太原两地 300mm 硅片合计产能已达 85 万片/月')",
      "太平洋证券 2023-04-17 产能表('设计产能 2100 吨/年,产能利用率 59.25%,在建产能…')",
      "Liu, W.-H., Chung, C.-F. & Chang, K.-L. (2013). Inventory change, capacity utilization and the semiconductor industry cycle. Economic Modelling 31:119-127"
    ],